Applying audio description for context understanding of surveillance videos by people with visual impairments,"Campos, V.P.| Goncalves, L.M.G.| De Araujo, T.M.U.",3,57192236386| 8843298100| 20435623900,2017,2017-10-20,"2017 14th IEEE International Conference on Advanced Video and Signal Based Surveillance, AVSS 2017",-,-,-,8078530,-,21100844810,Conference Proceeding,-,-,-,-,-,-,0.94,12,2,0.2,10.19,60,64,0,"Campos, V.P., Goncalves, L.M.G., De Araujo, T.M.U. (2017).Applying audio description for context understanding of surveillance videos by people with visual impairments. 2017 14th IEEE International Conference on Advanced Video and Signal Based Surveillance, AVSS 2017,",https://www.scopus.com/record/display.url?eid=2-s2.0-85039918374&origin=resultslist,10.1109/AVSS.2017.8078530,Conference Paper,,2-s2.0-85039918374,-,Universidade Federal do Rio Grande do Norte,1,60023857| 120016164,Universidade Federal do Rio Grande do Norte| Federal University of da Paraíba R. Dos Escoteiros,57192236386,20435623900,-,-,Brazil,1707| 1711,Computer Vision and Pattern Recognition| Signal Processing,-,"Algorithms,Computer Vision,Models",0,"First Person,Activity Recognition,Deep Learning",21072,99.799,94.245
Ensemble deep relevant learning framework for semi-supervised soft sensor modeling of industrial processes,"Moreira de Lima, J.M.| Ugulino de Araujo, F.M.",2,57223363552| 35316777100,2021,2021-10-28,Neurocomputing,462,-,154-168,-,ISSN-09252312,24807,Journal,-,7,-,6,-,16,0.53,7,2,0.86,2.33,19,29,0,"Moreira de Lima, J.M., Ugulino de Araujo, F.M. (2021).Ensemble deep relevant learning framework for semi-supervised soft sensor modeling of industrial processes. Neurocomputing,462154-168",https://www.scopus.com/record/display.url?eid=2-s2.0-85113677706&origin=resultslist,10.1016/j.neucom.2021.07.086,Article,,2-s2.0-85113677706,-,Universidade Federal do Rio Grande do Norte,1,60023857,Universidade Federal do Rio Grande do Norte,57223363552,35316777100,57223363552,-,Brazil,1702| 1706| 2805,Artificial Intelligence| Computer Science Applications| Cognitive Neuroscience,-,"Fault Detection,Process Monitoring,Principal Component Analysis",899,"Soft Sensor,Just-In-Time (JIT),Prediction",12405,57.592,96.477
Requirements for an integrated conditioning circuit for multiphase flow imaging using impedance wire-mesh sensors,"Filho, J.B.S.| Costa, C.A.M.| Cunha, G.C.L.| Belfort, D.R.| Catunda, S.Y.C.| Dos Santos, E.N.| Da Silva, M.J.",7,57213106591| 57224670238| 56180373700| 24775112000| 6602674444| 55486051100| 18633692300,2016,2016-04-11,"LASCAS 2016 - 7th IEEE Latin American Symposium on Circuits and Systems, R9 IEEE CASS Flagship Conference",-,-,291-294,7451067,-,21100775005,Conference Proceeding,-,-,-,-,-,-,0.84,15,2,0.0,3.27,61,72,0,"Filho, J.B.S., Costa, C.A.M., Cunha, G.C.L. and 4 more (...) (2016).Requirements for an integrated conditioning circuit for multiphase flow imaging using impedance wire-mesh sensors. LASCAS 2016 - 7th IEEE Latin American Symposium on Circuits and Systems, R9 IEEE CASS Flagship Conference,291-294",https://www.scopus.com/record/display.url?eid=2-s2.0-84982854630&origin=resultslist,10.1109/LASCAS.2016.7451067,Conference Paper,,2-s2.0-84982854630,-,Universidade Tecnológica Federal do Paraná| Universidade Federal do Rio Grande do Norte,2,60023857| 60027294,Universidade Federal do Rio Grande do Norte| Universidade Tecnológica Federal do Paraná,57213106591,18633692300,-,-,Brazil,1708| 2207| 2208,Hardware and Architecture| Control and Systems Engineering| Electrical and Electronic Engineering,-,"Tomography,Electric Impedance Tomography,Electric Impedance Measurement",1055,"Computer-Assisted Image Processing,Computer Assisted Impedance Tomography,Reconstruction Algorithm",1999,40,95.199
Sharp Rejection and Wide Stopband Microstrip Lowpass Filters using Complementary Split Ring Resonators,"da Costa, I.F.| Campos, A.L.P.S.| Gomes Neto, A.",3,57201699342| 16309023400| 6603647208,2018,2018-01-01,"Journal of Microwaves, Optoelectronics and Electromagnetic Applications",17,1,102-120,-,ISSN-21791074,20500195068,Journal,0.45,69,1,69,0.181,71,0.53,10,2,0.18,11.26,57,67,0,"da Costa, I.F., Campos, A.L.P.S., Gomes Neto, A. (2018).Sharp Rejection and Wide Stopband Microstrip Lowpass Filters using Complementary Split Ring Resonators. Journal of Microwaves, Optoelectronics and Electromagnetic Applications,17(1) 102-120",https://www.scopus.com/record/display.url?eid=2-s2.0-85045836806&origin=resultslist,10.1590/2179-10742018v17i11101,Article,Gold|Green,2-s2.0-85045836806,-,Universidade Federal do Rio Grande do Norte,1,107942947| 60023857| 115392197,Universidade Estadual do Rio Grande do Norte| Universidade Federal do Rio Grande do Norte| Federal Institute of Paraíba (IFPB),57201699342,6603647208,57201699342,-,Brazil,2208,Electrical and Electronic Engineering,-,"Antennas,Slot Antennas,Microwave Antennas",55,"Defected Ground Structures,Microstrip Filters,Compact",3977,93.043,84.974
Stochastic Petri net model describing the relationship between reported maternal and congenital syphilis cases in Brazil,"Valentim, R.A.M.| Caldeira-Silva, G.J.P.| da Silva, R.D.| Albuquerque, G.A.| de Andrade, I.G.M.| Sales-Moioli, A.I.L.| Pinto, T.K.B.| Miranda, A.E.| Galvão-Lima, L.J.| Cruz, A.S.| Barros, D.M.S.| Rodrigues, A.G.C.D.R.",12,35606294400| 57454516200| 57226102592| 57454497300| 57248097400| 57454533800| 57454516300| 7102302907| 57190952645| 57214610064| 57216405721| 57454516400,2022,2022-12-01,BMC Medical Informatics and Decision Making,22,1,-,40,ISSN-14726947,23602,Journal,-,-,-,22,-,29,1.35,6,2,10.79,0.19,3,2,0,"Valentim, R.A.M., Caldeira-Silva, G.J.P., da Silva, R.D. and 9 more (...) (2022).Stochastic Petri net model describing the relationship between reported maternal and congenital syphilis cases in Brazil. BMC Medical Informatics and Decision Making,22(1) ",https://www.scopus.com/record/display.url?eid=2-s2.0-85124680102&origin=resultslist,10.1186/s12911-022-01773-1,Article,Gold|Green,2-s2.0-85124680102,35168629,Universidade Federal do Espírito Santo| Universidade Federal do Rio Grande do Norte,2,60023857| 122729990| 60028426| 60023857,Universidade Federal do Rio Grande do Norte| Federal Institute of Rio Grande do Norte| Federal University of Espirito Santo| Universidade Federal do Rio Grande do Norte,35606294400,57454516400,57216405721,-,Brazil,2718| 2719,Health Informatics| Health Policy,SDG 3| SDG 10,"Syphilis,Chlamydia Trachomatis,Infection",348,"Congenital Syphilis,Pregnancy,Vertical Infectious Disease Transmission",9399,69.431,88.678
Genetic algorithm optimization of a CPW fed UWB circular ring monopole with modified ground plane,"Rodrigues, E.J.B.| D'Assunção, A.G.| Lins, H.W.C.| Peixeiro, C.",4,23991424200| 7004474343| 57222580164| 6701730449,2016,2016-06-01,Microwave and Optical Technology Letters,58,6,1319-1323,-,ISSN-08952477,12250,Journal,0.56,58,1.6,50,0.278,50,0.81,25,2,0.11,9.19,61,69,0,"Rodrigues, E.J.B., D'Assunção, A.G., Lins, H.W.C. and 1 more (...) (2016).Genetic algorithm optimization of a CPW fed UWB circular ring monopole with modified ground plane. Microwave and Optical Technology Letters,58(6) 1319-1323",https://www.scopus.com/record/display.url?eid=2-s2.0-84961743225&origin=resultslist,10.1002/mop.29794,Article,,2-s2.0-84961743225,-,University of Lisbon| Instituto de Telecomunicações| Universidade Federal do Rio Grande do Norte,3,60023857| 114729310| 60017375| 60004956| 60106051,Universidade Federal do Rio Grande do Norte| National Agency of Telecommunications| Instituto de Telecomunicacoes| Instituto Superior Técnico| Universidade de Lisboa,23991424200,6701730449,7004474343,-,Portugal| Brazil,2208| 2504| 3104| 3107,"Electrical and Electronic Engineering| Electronic, Optical and Magnetic Materials| Condensed Matter Physics| Atomic and Molecular Physics, and Optics",-,"Antennas,Slot Antennas,Microwave Antennas",55,"Antenna,P-i-n Diodes,Reconfigurable",3235,93.043,97.638
On the k-Medoids Model for Semi-supervised Clustering,"Randel, R.| Aloise, D.| Mladenović, N.| Hansen, P.",4,57208179119| 12759644500| 55947364100| 35616121500,2019,2019-01-01,Lecture Notes in Computer Science (including subseries Lecture Notes in Artificial Intelligence and Lecture Notes in Bioinformatics),11328,-,13-27,-,ISSN-03029743,25674,Book Series,0.71,50,1.9,43,0.427,32,1.01,15,2,0.7,2.84,52,39,0,"Randel, R., Aloise, D., Mladenović, N. and 1 more (...) (2019).On the k-Medoids Model for Semi-supervised Clustering. Lecture Notes in Computer Science (including subseries Lecture Notes in Artificial Intelligence and Lecture Notes in Bioinformatics),1132813-27",https://www.scopus.com/record/display.url?eid=2-s2.0-85064060997&origin=resultslist,10.1007/978-3-030-15843-9_2,Conference Paper,,2-s2.0-85064060997,-,University of Montreal| Mathematical Institute of the Serbian Academy of Sciences and Arts| HEC Montreal| Polytechnique Montreal,4,60019141| 60019141| 60068830| 60068829| 60002970| 60002970,Polytechnique Montréal| Polytechnique Montréal| Matematički Institut SANU| Srpska akademija nauka i umetnosti| HEC Montréal| HEC Montréal,57208179119,35616121500,57208179119,-,Serbia| Canada,1700| 2614,General Computer Science| Theoretical Computer Science,-,"Clustering Algorithms,Data Mining,Cluster Analysis",740,"Artificial Intelligence,Constraint Propagation,Pairwise",24649,46.02,73.657
Boosting memory access locality of the Spectral Element Method with Hilbert space-filling curves,"Araújo, R.R.F.| Gross, L.| Xavier-de-Souza, S.",3,57193664836| 35193779000| 7801645972,2021,2021-12-01,Computers and Geosciences,157,-,-,104938,ISSN-00983004,110327,Journal,-,13,-,17,-,16,0.17,2,2,0.93,2.14,19,27,0,"Araújo, R.R.F., Gross, L., Xavier-de-Souza, S. (2021).Boosting memory access locality of the Spectral Element Method with Hilbert space-filling curves. Computers and Geosciences,157",https://www.scopus.com/record/display.url?eid=2-s2.0-85115812202&origin=resultslist,10.1016/j.cageo.2021.104938,Article,Green,2-s2.0-85115812202,-,University of Queensland,1,126950316| 60031004,Centro de Tecnologia| The University of Queensland,57193664836,7801645972,57193664836,-,Australia| Brazil,1710| 1903,Information Systems| Computers in Earth Sciences,-,"Seismic Waves,Seismology,Seismic Data",371,"Wave Equations,Numerical Methods,Isotropic Media",8236,60.936,87.795
Design of modified pythagorean fractal antenna for multiband application,"Silva, H.A.M.| D'Assuncao, A.G.| Silva, J.P.",3,57194429508| 7004474343| 57212234960,2017,2017-05-01,"2017 International Applied Computational Electromagnetics Society Symposium - Italy, ACES 2017",-,-,-,7916052,-,21100817416,Conference Proceeding,-,-,-,-,-,-,1.11,13,2,0.83,2.42,60,34,0,"Silva, H.A.M., D'Assuncao, A.G., Silva, J.P. (2017).Design of modified pythagorean fractal antenna for multiband application. 2017 International Applied Computational Electromagnetics Society Symposium - Italy, ACES 2017,",https://www.scopus.com/record/display.url?eid=2-s2.0-85020125936&origin=resultslist,10.23919/ROPACES.2017.7916052,Conference Paper,,2-s2.0-85020125936,-,Universidade Federal do Rio Grande do Norte,1,60023857,Universidade Federal do Rio Grande do Norte,57194429508,57212234960,-,-,Brazil,1711| 2605| 3105| 3108,Signal Processing| Computational Mathematics| Instrumentation| Radiation,-,"Antennas,Slot Antennas,Microwave Antennas",55,"Patch Antennas,Sierpinski Carpet,Antenna",9952,93.043,88.615
Performance and Energy Efficiency Trade-Offs in Single-ISA Heterogeneous Multi-Processing for Parallel Applications,"Coutinho, D.A.M.| Georgiou, K.| Eder, K.I.| Nunez-Yanez, J.| Xavier-De-Souza, S.",5,57212480741| 57150810600| 23391989300| 55891805600| 7801645972,2019,2019-10-01,"IEEE/IFIP International Conference on VLSI and System-on-Chip, VLSI-SoC",2019-,-,232-233,8920384,ISSN-23248432,21100307476,Conference Proceeding,-,-,-,-,-,-,0.75,9,2,0.57,3.49,52,45,0,"Coutinho, D.A.M., Georgiou, K., Eder, K.I. and 2 more (...) (2019).Performance and Energy Efficiency Trade-Offs in Single-ISA Heterogeneous Multi-Processing for Parallel Applications. IEEE/IFIP International Conference on VLSI and System-on-Chip, VLSI-SoC,2019-232-233",https://www.scopus.com/record/display.url?eid=2-s2.0-85076804145&origin=resultslist,10.1109/VLSI-SoC.2019.8920384,Conference Paper,,2-s2.0-85076804145,-,University of Bristol| Universidade Federal do Rio Grande do Norte,2,113731905| 60020650| 60023857,Instituto Federal Do Rio Grande Do Norte - IFRN| University of Bristol| Universidade Federal do Rio Grande do Norte,57212480741,7801645972,-,-,United Kingdom| Brazil,1708| 1712| 2208,Hardware and Architecture| Software| Electrical and Electronic Engineering,SDG 7,"Data Storage Equipment,Program Processors,Applications",92,"Dynamic Frequency Scaling,Computing Methodologies,Voltage Scaling",13059,78.06,91.032
Energy performance of NTC-based constant temperature anemometers,"Assis, R.F.A.| Catunda, S.Y.C.| Belfort, D.R.| Muller, I.",4,57200413673| 6602674444| 24775112000| 24776461300,2017,2017-11-09,"INSCIT 2017 - 2nd International Symposium on Instrumentation Systems, Circuits and Transducers: Chip on the Sands, Proceedings",-,-,-,8103533,-,21100849119,Conference Proceeding,-,-,-,-,-,-,1.27,16,2,0.76,2.64,60,37,0,"Assis, R.F.A., Catunda, S.Y.C., Belfort, D.R. and 1 more (...) (2017).Energy performance of NTC-based constant temperature anemometers. INSCIT 2017 - 2nd International Symposium on Instrumentation Systems, Circuits and Transducers: Chip on the Sands, Proceedings,",https://www.scopus.com/record/display.url?eid=2-s2.0-85041218009&origin=resultslist,10.1109/INSCIT.2017.8103533,Conference Paper,,2-s2.0-85041218009,-,Universidade Federal do Rio Grande do Sul| Universidade Federal do Rio Grande do Norte,2,60023857| 60023857| 60006726,Universidade Federal do Rio Grande do Norte| Universidade Federal do Rio Grande do Norte| Universidade Federal do Rio Grande do Sul,57200413673,24776461300,-,-,Brazil,2208| 3105,Electrical and Electronic Engineering| Instrumentation,-,"Reynolds Number,Boundary Layers,Large Eddy Simulation",34,"Anemometry,Wheatstone Bridges,Temperature",24450,90.368,58.298
Methodology to Perform Real-Time Simulation of Power Systems Using a FPGA-based Platform,"Leal, M.S.R.| Simões, L.D.| França, R.L.S.| Leal, M.M.| Costa, F.B.| Taveiros, F.E.",6,57202999780| 57207301320| 57203003614| 57203387044| 22333585200| 56132137800,2019,2019-01-07,WCNPS 2018 - Workshop on Communication Networks and Power Systems,-,-,-,8604373,-,21100900303,Conference Proceeding,-,-,-,-,-,-,0.81,10,2,0.93,2.15,52,31,0,"Leal, M.S.R., Simões, L.D., França, R.L.S. and 3 more (...) (2019).Methodology to Perform Real-Time Simulation of Power Systems Using a FPGA-based Platform. WCNPS 2018 - Workshop on Communication Networks and Power Systems,",https://www.scopus.com/record/display.url?eid=2-s2.0-85062383890&origin=resultslist,10.1109/WCNPS.2018.8604373,Conference Paper,,2-s2.0-85062383890,-,Universidade Federal do Rio Grande do Norte,1,60023857| 60023857| 101106595,Universidade Federal do Rio Grande do Norte| Universidade Federal do Rio Grande do Norte| Launching Center of Barreira do Inferno,57202999780,56132137800,-,-,Brazil,1705| 2102| 2213| 2606,"Computer Networks and Communications| Energy Engineering and Power Technology| Safety, Risk, Reliability and Quality| Control and Optimization",-,"Electric Potential,Electric Inverters,DC-DC Converters",13,"Hardware-In-The-Loop,Field Programmable Gate Array,Power Electronics",7456,98.462,95.458
Low learning-cost offline strategies for EDP optimization of parallel applications,"Berned, G.P.| Rossi, F.D.| Luizelli, M.C.| de Souza, S.X.| Beck, A.C.S.| Lorenzon, A.F.",6,57216945477| 55482352100| 56516976700| 7801645972| 9732411800| 55561944100,2021,2021-03-01,Journal of Systems Architecture,114,-,-,101959,ISSN-13837621,12398,Journal,-,20,-,26,-,24,0.22,4,2,0.82,2.43,19,30,0,"Berned, G.P., Rossi, F.D., Luizelli, M.C. and 3 more (...) (2021).Low learning-cost offline strategies for EDP optimization of parallel applications. Journal of Systems Architecture,114",https://www.scopus.com/record/display.url?eid=2-s2.0-85097470784&origin=resultslist,10.1016/j.sysarc.2020.101959,Article,,2-s2.0-85097470784,-,Universidade Federal do Rio Grande do Sul| Universidade Federal do Pampa| Universidade Federal do Rio Grande do Norte,3,114459482| 60023857| 60006726| 60082715,Federal Institute Farroupilha| Universidade Federal do Rio Grande do Norte| Universidade Federal do Rio Grande do Sul| Universidade Federal do Pampa,57216945477,55561944100,55561944100,-,Brazil,1708| 1712,Hardware and Architecture| Software,-,"Data Storage Equipment,Program Processors,Applications",92,"Dynamic Frequency Scaling,Computing Methodologies,Voltage Scaling",13059,78.06,91.032
CO2 Catcher: A Platform for Monitoring of Vehicular Pollution in Smart Cities,"Oliveira, J.| Lemos, J.| Vieira, E.| Silva, I.| Abrantes, J.| Barros, D.| Daniel Costa, G.",7,57225944507| 57204771954| 57204021700| 36537969500| 57188728526| 57212785679| 35519411300,2018,2018-10-19,"2017 IEEE 1st Summer School on Smart Cities, S3C 2017 - Proceedings",-,-,37-42,8501380,-,21100887499,Conference Proceeding,-,-,-,-,-,-,1.15,18,2,0.77,2.58,57,36,0,"Oliveira, J., Lemos, J., Vieira, E. and 4 more (...) (2018).CO2 Catcher: A Platform for Monitoring of Vehicular Pollution in Smart Cities. 2017 IEEE 1st Summer School on Smart Cities, S3C 2017 - Proceedings,37-42",https://www.scopus.com/record/display.url?eid=2-s2.0-85054473824&origin=resultslist,10.1109/S3C.2017.8501380,Conference Paper,,2-s2.0-85054473824,-,Universidade Estadual de Feira de Santana| Universidade Federal do Rio Grande do Norte,2,60023857| 121674884| 60013906,Universidade Federal do Rio Grande do Norte| Logap Sistemas| Universidade Estadual de Feira de Santana,57225944507,35519411300,-,-,Brazil,1702| 3313| 3322,Artificial Intelligence| Transportation| Urban Studies,SDG 11,"Research,Technology,Industry",637,"Smart Cities,Big Data,Internet of Things",13953,80.268,99.839
Performance evaluation of a vehicular edge device for customer feedback in Industry 4.0,"Silva, M.| Signoretti, G.| Silva, I.| Ferrari, P.",4,57207807053| 57192920994| 36537969500| 57195277194,2020,2020-12-01,Acta IMEKO,9,4,88-95,-,ISSN-0237028X,21100407601,Journal,0.46,71,1.3,66,0.178,77,1.56,27,2,0.37,5.39,43,51,0,"Silva, M., Signoretti, G., Silva, I. and 1 more (...) (2020).Performance evaluation of a vehicular edge device for customer feedback in Industry 4.0. Acta IMEKO,9(4) 88-95",https://www.scopus.com/record/display.url?eid=2-s2.0-85098175987&origin=resultslist,10.21014/acta_imeko.v9i4.719,Article,Gold,2-s2.0-85098175987,-,Universidade Federal do Rio Grande do Norte| University of Brescia,2,60023857| 60015300,Universidade Federal do Rio Grande do Norte| Università degli Studi di Brescia,57207807053,57195277194,57207807053| 36537969500,-,Italy| Brazil,2208| 2210| 3105,Electrical and Electronic Engineering| Mechanical Engineering| Instrumentation,SDG 9| SDG 11,"Cloud Computing,Clouds,Distributed Computer Systems",70,"Edge Computing,Internet Of Things,Location Awareness",4790,96.321,99.956
Second-order Thermal Sigma-Delta applied to resistive bolometers on infrared detection,"Vitorino, B.A.F.| Belfort, D.R.| Catunda, S.Y.C.| Denoual, M.| Freire, R.C.S.",5,57191961380| 24775112000| 6602674444| 6507074952| 15922490800,2016,2016-10-18,"2016 1st Symposium on Instrumentation Systems, Circuits and Transducers, INSCIT 2016 - Proceedings",-,-,122-126,7598214,-,21100785512,Conference Proceeding,-,-,-,-,-,-,0.26,9,2,0.42,2.41,61,51,0,"Vitorino, B.A.F., Belfort, D.R., Catunda, S.Y.C. and 2 more (...) (2016).Second-order Thermal Sigma-Delta applied to resistive bolometers on infrared detection. 2016 1st Symposium on Instrumentation Systems, Circuits and Transducers, INSCIT 2016 - Proceedings,122-126",https://www.scopus.com/record/display.url?eid=2-s2.0-84995482242&origin=resultslist,10.1109/INSCIT.2016.7598214,Conference Paper,,2-s2.0-84995482242,-,Université de Caen| Normandie Université| Universidade Federal de Campina Grande| CNRS| École nationale supérieure d'ingénieurs de Caen| Universidade Federal do Rio Grande do Norte,6,113004547| 60023857| 60032215| 60032215| 60122535| 60122535| 60122535| 60122535| 60003709,"Federal Institute of Education| Universidade Federal do Rio Grande do Norte| Université de Caen Normandie| Université de Caen Normandie| GREYC - Groupe de Recherche en Informatique, Image, Automatique et Instrumentation de Caen| GREYC - Groupe de Recherche en Informatique, Image, Automatique et Instrumentation de Caen| GREYC - Groupe de Recherche en Informatique, Image, Automatique et Instrumentation de Caen| GREYC - Groupe de Recherche en Informatique, Image, Automatique et Instrumentation de Caen| Universidade Federal de Campina Grande",57191961380,15922490800,57191961380,-,France| Brazil,2208| 3105,Electrical and Electronic Engineering| Instrumentation,-,"MEMS,Gyroscopes,Resonators",246,"Sensor,Heat Flow,Micro-Electrical-Mechanical Systems",11816,75.652,89.267
One cycle control applied to a stand-alone photovoltaic system for DC microgrid applications,"De Carvalho Neto, J.T.| Salazar, A.O.| Maitelli, A.L.",3,55569752100| 7102422753| 6602549353,2016,2016-12-21,IECON Proceedings (Industrial Electronics Conference),-,-,3074-3079,7793737,-,56670,Conference Proceeding,0.58,57,-,-,-,-,1.04,17,2,0.69,2.88,61,39,0,"De Carvalho Neto, J.T., Salazar, A.O., Maitelli, A.L. (2016).One cycle control applied to a stand-alone photovoltaic system for DC microgrid applications. IECON Proceedings (Industrial Electronics Conference),3074-3079",https://www.scopus.com/record/display.url?eid=2-s2.0-85010046615&origin=resultslist,10.1109/IECON.2016.7793737,Conference Paper,,2-s2.0-85010046615,-,Universidade Federal do Rio Grande do Norte,1,60023857,Universidade Federal do Rio Grande do Norte,55569752100,6602549353,-,-,Brazil,2207| 2208,Control and Systems Engineering| Electrical and Electronic Engineering,SDG 7,"Electric Potential,Electric Inverters,DC-DC Converters",13,"Microgrid,DC-DC Converter,Electric Potential",2967,98.462,99.547
Accurate chronic wound area measurement using structure from motion,"Barbosa, F.M.C.| Carvalho, B.M.| Gomes, R.B.",3,57219052915| 8924126900| 23396733500,2020,2020-07-01,Proceedings - IEEE Symposium on Computer-Based Medical Systems,2020-,-,208-213,9183195,ISSN-10637125,23681,Conference Proceeding,0.47,71,1.8,62,-,-,0.82,7,2,1.19,1.69,43,24,0,"Barbosa, F.M.C., Carvalho, B.M., Gomes, R.B. (2020).Accurate chronic wound area measurement using structure from motion. Proceedings - IEEE Symposium on Computer-Based Medical Systems,2020-208-213",https://www.scopus.com/record/display.url?eid=2-s2.0-85091143282&origin=resultslist,10.1109/CBMS49503.2020.00047,Conference Paper,,2-s2.0-85091143282,-,Universidade Federal do Rio Grande do Norte,1,60023857,Universidade Federal do Rio Grande do Norte,57219052915,23396733500,-,-,Brazil,1706| 2741,"Computer Science Applications| Radiology, Nuclear Medicine and Imaging",-,"Wounds And Injuries,Pressure Ulcer,Bandages",372,"Diabetic Foot,Wounds And Injuries,Wound Healing",19405,61.873,82.826
An analysis of information dynamic behavior using autoregressive models,"Oliveira, A.| Neto, A.D.D.| Martins, A.",3,57204649407| 7102618949| 55415511600,2017,2017-11-01,Entropy,19,11,-,612,ISSN-10994300,13715,Journal,1.2,20,3.4,29,0.592,37,0.5,11,2,0.23,8.52,60,63,0,"Oliveira, A., Neto, A.D.D., Martins, A. (2017).An analysis of information dynamic behavior using autoregressive models. Entropy,19(11) ",https://www.scopus.com/record/display.url?eid=2-s2.0-85034255649&origin=resultslist,10.3390/e19110612,Article,Gold|Green,2-s2.0-85034255649,-,Universidade Federal do Rio Grande do Norte,1,109993987| 60023857| 60023857,Federal Rural University of Semi-Arid| Universidade Federal do Rio Grande do Norte| Universidade Federal do Rio Grande do Norte,57204649407,55415511600,57204649407,-,Brazil,1710| 2208| 2610| 3101,Information Systems| Electrical and Electronic Engineering| Mathematical Physics| Physics and Astronomy (miscellaneous),-,"Adaptive Filters,Algorithms,Active Noise Control",1072,"Adaptive Filtering,Impulsive Noise,Mean Square Error",37345,26.555,83.644
Higher order mode attenuation in microstrip patch antenna with DGS H filter specification from 5 to 10 GHz range,"De Souza, F.A.A.| De Siqueira Campos, A.L.P.| Neto, A.G.| Serres, A.J.R.| De Albuquerque, C.C.R.",5,57219119095| 57211219391| 6603647208| 36238364200| 57205417118,2020,2020-06-01,"Journal of Microwaves, Optoelectronics and Electromagnetic Applications",19,2,214-227,-,ISSN-21791074,20500195068,Journal,0.61,61,1.9,60,0.214,69,0.33,5,2,0.34,5.91,43,53,0,"De Souza, F.A.A., De Siqueira Campos, A.L.P., Neto, A.G. and 2 more (...) (2020).Higher order mode attenuation in microstrip patch antenna with DGS H filter specification from 5 to 10 GHz range. Journal of Microwaves, Optoelectronics and Electromagnetic Applications,19(2) 214-227",https://www.scopus.com/record/display.url?eid=2-s2.0-85091330217&origin=resultslist,10.1590/2179-10742020v19i2823,Article,Gold,2-s2.0-85091330217,-,Universidade Federal de Campina Grande| Universidade Federal do Rio Grande do Norte,2,122648092| 60023857| 113022837| 60003709,Federal Institute of Rio Grande do Norte| Universidade Federal do Rio Grande do Norte| Federal Institute of Paraíba| Universidade Federal de Campina Grande,57219119095,57205417118,-,-,Brazil,2208,Electrical and Electronic Engineering,-,"Antennas,Slot Antennas,Microwave Antennas",55,"Defected Ground Structures,Microstrip Filters,Compact",3977,93.043,84.974
