A power transformer differential protection based onsupport vector machine and wavelet transform,"Simões, L.D.| Costa, H.J.D.| Aires, M.N.O.| Medeiros, R.P.| Costa, F.B.| Bretas, A.S.",6,57207301320| 57221681923| 57221683731| 56682611600| 22333585200| 6602790210,2021,2021-08-01,Electric Power Systems Research,197,-,-,107297,ISSN-03787796,16044,Journal,-,14,-,15,-,18,0.86,11,5,2.16,2.32,8,13,0,"Simões, L.D., Costa, H.J.D., Aires, M.N.O. and 3 more (...) (2021).A power transformer differential protection based onsupport vector machine and wavelet transform. Electric Power Systems Research,197",https://www.scopus.com/record/display.url?eid=2-s2.0-85105567135&origin=resultslist,10.1016/j.epsr.2021.107297,Article,,2-s2.0-85105567135,-,University of Florida| Universidade Federal do Rio Grande do Norte,2,60023857| 113139473| 60013959,Universidade Federal do Rio Grande do Norte| Federal Rural University of the Semi-Arid (UFERSA)| University of Florida,57207301320,6602790210,57207301320,-,United States| Brazil,2102| 2208,Energy Engineering and Power Technology| Electrical and Electronic Engineering,-,"Electric Fault Location,Electric Lines,Electric Power Distribution",407,"Power Transformer,Electric Instrument Transformers,Electric Fault Currents",5219,64.883,90.632
When parallel speedups hit the memory wall,"Furtunato, A.F.A.| Georgiou, K.| Eder, K.| Xavier-De-Souza, S.",4,57215310489| 57150810600| 23391989300| 7801645972,2020,2020-01-01,IEEE Access,8,-,79225-79238,9078685,ISSN-21693536,21100374601,Journal,1.42,18,4.8,13,0.587,22,0.31,6,5,0.97,5.17,25,29,0,"Furtunato, A.F.A., Georgiou, K., Eder, K. and 1 more (...) (2020).When parallel speedups hit the memory wall. IEEE Access,879225-79238",https://www.scopus.com/record/display.url?eid=2-s2.0-85084797354&origin=resultslist,10.1109/ACCESS.2020.2990418,Article,Gold|Green,2-s2.0-85084797354,-,University of Bristol| Universidade Federal do Rio Grande do Norte,2,124426348| 60020650| 60023857,Diretoria Acadêmica de Recursos Naturais| University of Bristol| Universidade Federal do Rio Grande do Norte,57215310489,7801645972,57215310489,-,United Kingdom| Brazil,1700| 2200| 2500,General Computer Science| General Engineering| General Materials Science,-,"Data Storage Equipment,Program Processors,Applications",92,"Program Processors,Multi-Core Processor,International Sociological Association",16658,78.06,89.797
On the use of LoRaWAN for the Internet of Intelligent Vehicles in Smart City scenarios,"Ferrari, P.| Sisinni, E.| Carvalho, D.F.| Depari, A.| Signoretti, G.| Silva, M.| Silva, I.| Silva, D.",8,57195277194| 24777116800| 57202969056| 6506527036| 57192920994| 57207807053| 36537969500| 24722389500,2020,2020-03-01,"2020 IEEE Sensors Applications Symposium, SAS 2020 - Proceedings",-,-,-,9220069,-,21101026898,Conference Proceeding,-,-,-,-,-,-,1.48,12,5,3.23,1.55,25,6,0,"Ferrari, P., Sisinni, E., Carvalho, D.F. and 5 more (...) (2020).On the use of LoRaWAN for the Internet of Intelligent Vehicles in Smart City scenarios. 2020 IEEE Sensors Applications Symposium, SAS 2020 - Proceedings,",https://www.scopus.com/record/display.url?eid=2-s2.0-85095579905&origin=resultslist,10.1109/SAS48726.2020.9220069,Conference Paper,,2-s2.0-85095579905,-,Universidade Federal do Rio Grande do Norte| University of Brescia,2,60015300| 60023857,Università degli Studi di Brescia| Universidade Federal do Rio Grande do Norte,57195277194,24722389500,-,-,Italy| Brazil,1706| 1707| 3105,Computer Science Applications| Computer Vision and Pattern Recognition| Instrumentation,SDG 9| SDG 11,"Radio Frequency Identification (RFID),Technology,Internet",872,"Chloralodol,Hyaluronate Lyase,Low Power",45602,74.114,99.395
"Green Robotics: Concepts, challenges, and strategies","Alves Filho, S.E.| Medeiros Filgueira Burlamaqui, A.| Vidal Aroca, R.| Garcia Goncalves, L.M.| Lima Sa, S.T.D.",5,56022590800| 55437702900| 57202422528| 8843298100| 57202424419,2018,2018-04-01,IEEE Latin America Transactions,16,4,1042-1050,-,ISSN-15480992,19700181218,Journal,0.71,50,1.7,43,0.337,36,1.29,27,5,0.48,10.34,41,49,0,"Alves Filho, S.E., Medeiros Filgueira Burlamaqui, A., Vidal Aroca, R. and 2 more (...) (2018).Green Robotics: Concepts, challenges, and strategies. IEEE Latin America Transactions,16(4) 1042-1050",https://www.scopus.com/record/display.url?eid=2-s2.0-85048267278&origin=resultslist,10.1109/TLA.2018.8362135,Article,,2-s2.0-85048267278,-,Universidade Federal de São Carlos| Universidade do Estado do Rio Grande do Norte,2,60011385| 108436612| 60013792,"Universidade do Estado do Rio Grande do Norte| Instituto Federal de Educação, Ciência e Tecnologia Do Rio Grande Do Norte (IFRN)| Universidade Federal de São Carlos",56022590800,57202424419,56022590800,-,Brazil,1700| 2208,General Computer Science| Electrical and Electronic Engineering,SDG 9| SDG 12,"Industry,Information Systems,Research",254,"Green Computing,IT Adoption,Sustainable Development",13226,87.023,91.711
Low Cost and Low Power Stacked Sparse Autoencoder Hardware Acceleration for Deep Learning Edge Computing Applications,"Belabed, T.| Coutinho, M.G.F.| Fernandes, M.A.C.| Carlos, V.| Souani, C.",5,57202465438| 57208260908| 7202947679| 57188874568| 6506039838,2020,2020-09-01,"2020 International Conference on Advanced Technologies for Signal and Image Processing, ATSIP 2020",-,-,-,9231748,-,21101028316,Conference Proceeding,-,-,-,-,-,-,0.34,3,5,2.92,1.71,25,7,0,"Belabed, T., Coutinho, M.G.F., Fernandes, M.A.C. and 2 more (...) (2020).Low Cost and Low Power Stacked Sparse Autoencoder Hardware Acceleration for Deep Learning Edge Computing Applications. 2020 International Conference on Advanced Technologies for Signal and Image Processing, ATSIP 2020,",https://www.scopus.com/record/display.url?eid=2-s2.0-85096544194&origin=resultslist,10.1109/ATSIP49331.2020.9231748,Conference Paper,,2-s2.0-85096544194,-,Universite de Mons| University of Monastir| Universidade Federal do Rio Grande do Norte,3,60010758| 60031295| 60023857| 60091646| 60050038,Université de Mons| Université de Mons - Faculté Polytechnique de Mons| Universidade Federal do Rio Grande do Norte| Faculty of Sciences of Monastir| Université de Monastir,57202465438,6506039838,-,-,Belgium| Tunisia| Brazil,1707| 1711| 1804| 2213| 2613,"Computer Vision and Pattern Recognition| Signal Processing| Statistics, Probability and Uncertainty| Safety, Risk, Reliability and Quality| Statistics and Probability",-,"Algorithms,Computer Vision,Models",0,"Object Detection,Deep Learning,IOU",4338,99.799,99.998
Time-effective GPS time domain signal Acquisition Algorithm,"Albuquerque, G.L.A.| Valderrama, C.| Silva, F.C.| Xavier-De-Souza, S.",4,55191031900| 6602815648| 57191055730| 7801645972,2016,2016-08-04,"Proceedings of 2016 International Conference on Localization and GNSS, ICL-GNSS 2016",-,-,-,7533687,-,21100777503,Conference Proceeding,-,-,-,-,-,-,0.12,4,5,0.88,3.42,46,33,0,"Albuquerque, G.L.A., Valderrama, C., Silva, F.C. and 1 more (...) (2016).Time-effective GPS time domain signal Acquisition Algorithm. Proceedings of 2016 International Conference on Localization and GNSS, ICL-GNSS 2016,",https://www.scopus.com/record/display.url?eid=2-s2.0-84986208973&origin=resultslist,10.1109/ICL-GNSS.2016.7533687,Conference Paper,,2-s2.0-84986208973,-,Universite de Mons| Universidade Federal do Rio Grande do Norte,2,60010758| 60023857,Université de Mons| Universidade Federal do Rio Grande do Norte,55191031900,7801645972,-,-,Belgium| Brazil,1705| 1711| 2606,Computer Networks and Communications| Signal Processing| Control and Optimization,-,"Global Positioning System,Satellites,Navigation",712,"Recipient,Weak Signal,Bit Synchronization",3548,60.803,86.682
Performance of License Assisted Access Solutions Using ns-3,"Santana, P.M.D.| Melo, V.D.D.L.| De Sousa, V.A.",3,57205347855| 57193878119| 6603844872,2017,2017-03-17,"Proceedings - 2016 International Conference on Computational Science and Computational Intelligence, CSCI 2016",-,-,941-946,7881474,-,21100805779,Conference Proceeding,-,-,-,-,-,-,0.33,6,5,0.72,4.17,44,38,0,"Santana, P.M.D., Melo, V.D.D.L., De Sousa, V.A. (2017).Performance of License Assisted Access Solutions Using ns-3. Proceedings - 2016 International Conference on Computational Science and Computational Intelligence, CSCI 2016,941-946",https://www.scopus.com/record/display.url?eid=2-s2.0-85017302455&origin=resultslist,10.1109/CSCI.2016.0181,Conference Paper,,2-s2.0-85017302455,-,Universidade Federal do Rio Grande do Norte,1,60023857,Universidade Federal do Rio Grande do Norte,57205347855,6603844872,-,-,Brazil,1702| 1705| 1706| 1710| 2718,Artificial Intelligence| Computer Networks and Communications| Computer Science Applications| Information Systems| Health Informatics,-,"Cognitive Radio,MIMO Systems,Orthogonal Frequency Division Multiplexing",3,"Local Thermodynamic Equilibrium,Wi-Fi,Long Term Evolution (LTE)",48253,97.793,92.703
Hierarchical reinforcement learning and parallel computing applied to the k-server problem,"Costa, M.L.| Padilha, C.A.A.| Melo, J.D.| Neto, A.D.D.",4,57192693306| 41262081900| 55664205300| 7102618949,2016,2016-10-01,IEEE Latin America Transactions,14,10,4351-4357,7786315,ISSN-15480992,19700181218,Journal,0.66,51,0.8,70,0.227,50,0.63,14,5,0.15,6.63,46,67,0,"Costa, M.L., Padilha, C.A.A., Melo, J.D. and 1 more (...) (2016).Hierarchical reinforcement learning and parallel computing applied to the k-server problem. IEEE Latin America Transactions,14(10) 4351-4357",https://www.scopus.com/record/display.url?eid=2-s2.0-85007460000&origin=resultslist,10.1109/TLA.2016.7786315,Article,,2-s2.0-85007460000,-,Universidade Federal do Rio Grande do Sul| Universidade do Estado do Rio Grande do Norte| Universidade Federal do Rio Grande do Norte,3,60011385| 60023857| 60006726,Universidade do Estado do Rio Grande do Norte| Universidade Federal do Rio Grande do Norte| Universidade Federal do Rio Grande do Sul,57192693306,7102618949,57192693306,-,Brazil,1700| 2208,General Computer Science| Electrical and Electronic Engineering,-,"Scheduling,Algorithms,Optimization",192,"Competitive Analysis,Online Algorithms,Advice",16557,88.094,79.929
Heuristics for the dynamic facility location problem with modular capacities,"Silva, A.| Aloise, D.| Coelho, L.C.| Rocha, C.",4,57211991683| 12759644500| 54890623600| 25927437400,2021,2021-04-16,European Journal of Operational Research,290,2,435-452,-,ISSN-03772217,22489,Journal,-,4,-,3,-,2,4.42,84,5,2.51,1.99,8,11,0,"Silva, A., Aloise, D., Coelho, L.C. and 1 more (...) (2021).Heuristics for the dynamic facility location problem with modular capacities. European Journal of Operational Research,290(2) 435-452",https://www.scopus.com/record/display.url?eid=2-s2.0-85090312048&origin=resultslist,10.1016/j.ejor.2020.08.018,Article,,2-s2.0-85090312048,-,University of Montreal| GERAD| Polytechnique Montreal| Universidade Federal do Rio Grande do Norte| McGill University| Université Laval,6,60032619| 60007104| 60007104| 60007104| 60019141| 60019141| 60032619| 60023857,Université Laval| Groupe d'études et de Recherche en Analyse des Décisions| Groupe d'études et de Recherche en Analyse des Décisions| Groupe d'études et de Recherche en Analyse des Décisions| Polytechnique Montréal| Polytechnique Montréal| Université Laval| Universidade Federal do Rio Grande do Norte,57211991683,25927437400,57211991683,-,Brazil| Canada,1700| 1802| 1803| 2611,General Computer Science| Information Systems and Management| Management Science and Operations Research| Modeling and Simulation,-,"Supply Chains,Supply Chain Management,Industry",146,"Supply Chain Design,Costs And Cost Analysis,Multi-echelon",4524,98.06,97.382
Impact of PV systems on microgrids under different levels of penetration and operational scenarios,"Nunes, E.A.F.| Alves, D.K.| Dantas, E.S.| Rocha, T.O.A.| Ribeiro, R.L.A.| Costa, F.B.",6,57203121220| 56597608500| 57215297586| 55570200500| 7202534599| 22333585200,2017,2017-07-01,"14th Brazilian Power Electronics Conference, COBEP 2017",2018-,-,1-6,-,-,21100953529,Conference Proceeding,-,-,-,-,-,-,0.39,9,5,1.07,2.8,44,27,0,"Nunes, E.A.F., Alves, D.K., Dantas, E.S. and 3 more (...) (2017).Impact of PV systems on microgrids under different levels of penetration and operational scenarios. 14th Brazilian Power Electronics Conference, COBEP 2017,2018-1-6",https://www.scopus.com/record/display.url?eid=2-s2.0-85050548089&origin=resultslist,10.1109/COBEP.2017.8257336,Conference Paper,,2-s2.0-85050548089,-,Universidade Federal do Rio Grande do Norte,1,60023857,Universidade Federal do Rio Grande do Norte,57203121220,22333585200,-,-,Brazil,2102| 2208| 2606,Energy Engineering and Power Technology| Electrical and Electronic Engineering| Control and Optimization,SDG 7,"Electric Power Transmission Networks,Wind Power,Electric Power Distribution",28,"Solar Energy Conversion,Active Distribution Network,Voltage Control",6451,99.331,99.679
Design of a narrow band and wideband absorbers using resistive FSS concept for the X and Ku band application,"Silva, M.W.B.| Araujo, H.X.| Campos, A.L.P.S.",3,57220059007| 36865976500| 16309023400,2018,2018-09-01,Microwave and Optical Technology Letters,60,9,2128-2132,-,ISSN-08952477,12250,Journal,0.64,55,2.1,48,0.317,44,0.45,9,5,0.37,10.76,41,55,0,"Silva, M.W.B., Araujo, H.X., Campos, A.L.P.S. (2018).Design of a narrow band and wideband absorbers using resistive FSS concept for the X and Ku band application. Microwave and Optical Technology Letters,60(9) 2128-2132",https://www.scopus.com/record/display.url?eid=2-s2.0-85051294826&origin=resultslist,10.1002/mop.31305,Article,,2-s2.0-85051294826,-,Universidade Federal Fluminense| Universidade Federal do Rio Grande do Norte| Universidade Federal do Tocantins,3,60001865| 60016746| 60023857,Universidade Federal Fluminense| Universidade Federal do Tocantins| Universidade Federal do Rio Grande do Norte,57220059007,16309023400,36865976500,-,Brazil,2208| 2504| 3104| 3107,"Electrical and Electronic Engineering| Electronic, Optical and Magnetic Materials| Condensed Matter Physics| Atomic and Molecular Physics, and Optics",-,"Plasmons,Metamaterials,Surface Plasmon Resonance",47,"Metamaterials,Broadband,Frequency Selective Surfaces",3955,99.532,99.526
Design of rotatable metasurface microstrip antenna with reconfigurable polarization,"Araujo, F.F.| D'Assuncao, A.G.| Costa, L.F.V.T.| Alves, W.S.",4,57194409298| 7004474343| 57194410712| 57194409673,2017,2017-05-01,"2017 International Applied Computational Electromagnetics Society Symposium - Italy, ACES 2017",-,-,-,7916313,-,21100817102,Conference Proceeding,-,-,-,-,-,-,1.51,18,5,1.24,2.42,44,24,0,"Araujo, F.F., D'Assuncao, A.G., Costa, L.F.V.T. and 1 more (...) (2017).Design of rotatable metasurface microstrip antenna with reconfigurable polarization. 2017 International Applied Computational Electromagnetics Society Symposium - Italy, ACES 2017,",https://www.scopus.com/record/display.url?eid=2-s2.0-85020004929&origin=resultslist,10.23919/ROPACES.2017.7916313,Conference Paper,,2-s2.0-85020004929,-,Universidade Federal do Rio Grande do Norte,1,60023857,Universidade Federal do Rio Grande do Norte,57194409298,57194409673,-,-,Brazil,1711| 2605| 3105| 3108,Signal Processing| Computational Mathematics| Instrumentation| Radiation,-,"Antennas,Slot Antennas,Microwave Antennas",55,"Antenna,P-i-n Diodes,Reconfigurable",3235,93.043,97.638
A dependability evaluation for OBD-II Edge Devices: An Internet of Intelligent Vehicles perspective,"Signoretti, G.| Silva, M.| Araujo, J.| Silva, I.| Silva, D.| Ferrari, P.| Sisinni, E.",7,57192920994| 57207807053| 57215420722| 36537969500| 24722389500| 57195277194| 24777116800,2019,2019-11-01,"2019 9th Latin-American Symposium on Dependable Computing, LADC 2019 - Proceedings",-,-,-,8995679,-,21100970244,Conference Proceeding,-,-,-,-,-,-,1.38,18,5,1.86,2.69,35,15,0,"Signoretti, G., Silva, M., Araujo, J. and 4 more (...) (2019).A dependability evaluation for OBD-II Edge Devices: An Internet of Intelligent Vehicles perspective. 2019 9th Latin-American Symposium on Dependable Computing, LADC 2019 - Proceedings,",https://www.scopus.com/record/display.url?eid=2-s2.0-85081591459&origin=resultslist,10.1109/LADC48089.2019.8995679,Conference Paper,,2-s2.0-85081591459,-,Universidade Federal do Rio Grande do Norte| University of Brescia,2,123095599| 60023857| 60015300,Postgraduate Program in Electrical and Computer Engineering (PPgEEC)| Universidade Federal do Rio Grande do Norte| Università degli Studi di Brescia,57192920994,24777116800,-,-,Italy| Brazil,1705| 1708| 1802| 2213,"Computer Networks and Communications| Hardware and Architecture| Information Systems and Management| Safety, Risk, Reliability and Quality",SDG 7,"Embedded Systems,Scheduling,Real Time Systems",667,"Computer Security,CAN Bus,Electronic Control",30428,51.906,97.726
Chaos game representation dataset of SARS-CoV-2 genome,"Barbosa, R.D.M.| Fernandes, M.A.C.",2,56649607000| 7202947679,2020,2020-06-01,Data in Brief,30,-,-,105618,ISSN-23523409,21100372856,Journal,2,8,1.7,29,0.122,88,1.67,36,5,1.97,2.53,25,13,0,"Barbosa, R.D.M., Fernandes, M.A.C. (2020).Chaos game representation dataset of SARS-CoV-2 genome. Data in Brief,30",https://www.scopus.com/record/display.url?eid=2-s2.0-85083888161&origin=resultslist,10.1016/j.dib.2020.105618,Data Paper,Gold|Green,2-s2.0-85083888161,-,Massachusetts Institute of Technology| Universidade Federal do Rio Grande do Norte,2,60022195| 60023857| 60023857,Massachusetts Institute of Technology| Universidade Federal do Rio Grande do Norte| Universidade Federal do Rio Grande do Norte,56649607000,7202947679,7202947679,-,United States| Brazil,1000,Multidisciplinary,SDG 3,"COVID-19,SARS-CoV-2,Coronavirus",1500,"ARIMA,Mathematical Modeling,COVID-19",1102558,100,99.985
Butterfly neural equalizer applied to optical communication systems with two-dimensional digital modulation,"De Sousa, T.F.B.| Fernandes, M.A.C.",2,56258397000| 7202947679,2018,2018-11-12,Optics Express,26,23,30837-30850,-,ISSN-10944087,12862,Journal,1.63,10,6.8,12,1.473,11,0.52,9,5,0.47,10.65,41,49,0,"De Sousa, T.F.B., Fernandes, M.A.C. (2018).Butterfly neural equalizer applied to optical communication systems with two-dimensional digital modulation. Optics Express,26(23) 30837-30850",https://www.scopus.com/record/display.url?eid=2-s2.0-85056882900&origin=resultslist,10.1364/OE.26.030837,Article,Bronze,2-s2.0-85056882900,30469976,Universidade Federal do Rio Grande do Norte,1,113007445| 60023857,Federal Institute of Rio Grande do Norte (IFRN)| Universidade Federal do Rio Grande do Norte,56258397000,7202947679,7202947679,-,Brazil,3107,"Atomic and Molecular Physics, and Optics",-,"Neural Networks,Algorithms,Models",1009,"Complex,Time-Varying Delay,Quaternions",10218,27.492,92.496
Iterative Full-Wave Analysis of Mandelbrot-Inspired Fractal Patch Antenna on Textile Substrate for UWB Applications,"Silva Neto, V.P.| D'Assunção, A.G.",2,55908415500| 7004474343,2017,2017-01-01,International Journal of Antennas and Propagation,2017,-,-,4686315,ISSN-16875869,19700186861,Journal,0.64,53,2,45,0.233,59,0.67,16,5,0.38,10.44,44,53,0,"Silva Neto, V.P., D'Assunção, A.G. (2017).Iterative Full-Wave Analysis of Mandelbrot-Inspired Fractal Patch Antenna on Textile Substrate for UWB Applications. International Journal of Antennas and Propagation,2017",https://www.scopus.com/record/display.url?eid=2-s2.0-85042229951&origin=resultslist,10.1155/2017/4686315,Article,Gold|Green,2-s2.0-85042229951,-,Universidade Federal do Rio Grande do Norte,1,112801785| 60023857,Federal Rural University of the Semi-Arid Region| Universidade Federal do Rio Grande do Norte,55908415500,7004474343,55908415500,-,Brazil,2208,Electrical and Electronic Engineering,-,"Antennas,Slot Antennas,Microwave Antennas",55,"Frequency Selective Surfaces,Radomes,Polarization",3944,93.043,96.63
A state estimation approach for fault location in transmission lines considering data acquisition errors and non-synchronized records,"Da Cruz, M.C.S.| De Almeida, M.A.D.| De Medeiros, M.F.",3,57213933794| 57183701000| 6603603627,2016,2016-06-01,International Journal of Electrical Power and Energy Systems,78,-,663-671,-,ISSN-01420615,17985,Journal,1.86,7,7.9,3,1.472,7,0.65,20,5,0.3,9.88,46,58,0,"Da Cruz, M.C.S., De Almeida, M.A.D., De Medeiros, M.F. (2016).A state estimation approach for fault location in transmission lines considering data acquisition errors and non-synchronized records. International Journal of Electrical Power and Energy Systems,78663-671",https://www.scopus.com/record/display.url?eid=2-s2.0-84961148827&origin=resultslist,10.1016/j.ijepes.2015.12.017,Article,,2-s2.0-84961148827,-,Universidade Federal do Rio Grande do Norte,1,109636735| 60023857,Federal Rural University of Semi-Árido - UFERSA| Universidade Federal do Rio Grande do Norte,57213933794,6603603627,57213933794,-,Brazil,2102| 2208,Energy Engineering and Power Technology| Electrical and Electronic Engineering,-,"Electric Fault Location,Electric Lines,Electric Power Distribution",407,"Electric Fault Location,Fault Detection,Power Lines",1374,64.883,97.068
Parallel Implementation of K-Means Algorithm on FPGA,"Dias, L.A.| Ferreira, J.C.| Fernandes, M.A.C.",3,57216084309| 7403252405| 7202947679,2020,2020-01-01,IEEE Access,8,-,41071-41084,9016001,ISSN-21693536,21100374601,Journal,1.42,18,4.8,13,0.587,22,0.57,11,5,0.97,5.17,25,29,0,"Dias, L.A., Ferreira, J.C., Fernandes, M.A.C. (2020).Parallel Implementation of K-Means Algorithm on FPGA. IEEE Access,841071-41084",https://www.scopus.com/record/display.url?eid=2-s2.0-85081906361&origin=resultslist,10.1109/ACCESS.2020.2976900,Article,Gold|Green,2-s2.0-85081906361,-,University of Porto| Harvard University| Universidade Federal do Rio Grande do Norte,3,60023857| 60020432| 60007249| 60007249| 60023857| 60009982| 60077572,"Universidade Federal do Rio Grande do Norte| Institute for Systems and Computer Engineering, Technology and Science| Universidade do Porto| Universidade do Porto| Universidade Federal do Rio Grande do Norte| Harvard University| Harvard John A. Paulson School of Engineering and Applied Sciences",57216084309,7202947679,7202947679,-,United States| Portugal| Brazil,1700| 2200| 2500,General Computer Science| General Engineering| General Materials Science,-,"Field Programmable Gate Arrays (FPGA),Digital Arithmetic,Algorithms",1315,"K-Mean Clustering,Associative Memory,Field Programmable Gate Array",59829,22.742,51.707
Validation of a dynamic planning navigation strategy applied to mobile terrestrial robots,"Silva, C.A.D.| de Oliveira, Á.V.F.M.| Fernandes, M.A.C.",3,57205055291| 56804318900| 7202947679,2018,2018-12-01,Sensors (Switzerland),18,12,-,4322,ISSN-14248220,130124,Journal,1.62,10,4.3,18,0.592,26,0.27,6,5,0.44,11.24,41,51,0,"Silva, C.A.D., de Oliveira, Á.V.F.M., Fernandes, M.A.C. (2018).Validation of a dynamic planning navigation strategy applied to mobile terrestrial robots. Sensors (Switzerland),18(12) ",https://www.scopus.com/record/display.url?eid=2-s2.0-85058369766&origin=resultslist,10.3390/s18124322,Article,Gold|Green,2-s2.0-85058369766,30544556,Universidade Federal do Rio Grande do Norte,1,60023857,Universidade Federal do Rio Grande do Norte,57205055291,7202947679,7202947679,-,Brazil,1303| 1602| 2208| 3105| 3107,"Biochemistry| Analytical Chemistry| Electrical and Electronic Engineering| Instrumentation| Atomic and Molecular Physics, and Optics",-,"Multi Agent Systems,Motion Planning,Robots",285,"Ant Colony Optimisation,Artificial Potential Field,Mobile Robots",13631,90.903,94.596
Static output feedback control design for constrained linear discrete-time systems using data cluster analysis,"Dantas, A.D.O.S.| Dantas, A.F.O.A.| Dórea, C.E.T.",3,56022652300| 57203395728| 7004096252,2018,2018-12-18,IET Control Theory and Applications,12,18,2541-2550,-,ISSN-17518644,5100155079,Journal,1.31,17,6.3,3,1.363,7,0.51,12,5,0.44,11.43,41,51,0,"Dantas, A.D.O.S., Dantas, A.F.O.A., Dórea, C.E.T. (2018).Static output feedback control design for constrained linear discrete-time systems using data cluster analysis. IET Control Theory and Applications,12(18) 2541-2550",https://www.scopus.com/record/display.url?eid=2-s2.0-85061091631&origin=resultslist,10.1049/iet-cta.2018.5744,Article,Bronze,2-s2.0-85061091631,-,Universidade Potiguar| Universidade Federal do Rio Grande do Norte,2,60023857| 60027877,Universidade Federal do Rio Grande do Norte| Universidade Potiguar,56022652300,7004096252,56022652300,-,Brazil,1706| 1709| 2207| 2208| 2606,Computer Science Applications| Human-Computer Interaction| Control and Systems Engineering| Electrical and Electronic Engineering| Control and Optimization,-,"Control,Controllers,Linear Matrix Inequalities",9,"Linear System,Linear Parameter-varying Systems,Feedback Law",750,97.592,97.249
