Two approaches for clustering algorithms with relational-based data,"Xavier-Junior, J.C.| Canuto, A.M.P.| Gonçalves, L.M.G.",3,56366404800| 15022041200| 8843298100,2020,2020-03-01,Knowledge and Information Systems,62,3,1229-1253,-,ISSN-02191377,15703,Journal,1.81,10,5.8,21,0.634,23,0.48,13,0,0.0,7.04,68,68,0,"Xavier-Junior, J.C., Canuto, A.M.P., Gonçalves, L.M.G. (2020).Two approaches for clustering algorithms with relational-based data. Knowledge and Information Systems,62(3) 1229-1253",https://www.scopus.com/record/display.url?eid=2-s2.0-85069749969&origin=resultslist,10.1007/s10115-019-01384-9,Article,,2-s2.0-85069749969,-,-,0,100461819| 100461819| 100461819,Federal University of RN| Federal University of RN| Federal University of RN,56366404800,8843298100,56366404800,-,Brazil,1702| 1708| 1709| 1710| 1712,Artificial Intelligence| Hardware and Architecture| Human-Computer Interaction| Information Systems| Software,-,"Clustering Algorithms,Data Mining,Cluster Analysis",740,"Fuzzy Clustering,Fuzzy C-Mean Algorithm,Cluster Analysis",8414,46.02,87.962
Modeling of the GEMA: A novel web system for management of collaborative care in mental health,"Fontes, H.G.S.| Freire, C.R.| Nunes, E.A.| Filho, J.A.P.| Bezerra, H.S.M.| De Medeiros Valentim, R.A.",6,57204033668| 57216405540| 55077623100| 57204036681| 55929549700| 35606294400,2018,2018-01-01,"MCCSIS 2018 - Multi Conference on Computer Science and Information Systems; Proceedings of the International Conferences on e-Health 2018, ICT, Society, and Human Beings 2018 and Web Based Communities and Social Media 2018",-,-,69-76,-,-,21100878887,Conference Proceeding,-,-,-,-,-,-,0.71,13,0,0.0,3.75,77,75,0,"Fontes, H.G.S., Freire, C.R., Nunes, E.A. and 3 more (...) (2018).Modeling of the GEMA: A novel web system for management of collaborative care in mental health. MCCSIS 2018 - Multi Conference on Computer Science and Information Systems; Proceedings of the International Conferences on e-Health 2018, ICT, Society, and Human Beings 2018 and Web Based Communities and Social Media 2018,69-76",https://www.scopus.com/record/display.url?eid=2-s2.0-85054191685&origin=resultslist,-,Conference Paper,,2-s2.0-85054191685,-,Universidade Federal do Rio Grande do Norte,1,60023857,Universidade Federal do Rio Grande do Norte,57204033668,35606294400,-,-,Brazil,1700,General Computer Science,-,"Brazil,Health,Nursing",390,"Brazil,Social Psychiatry,Deinstitutionalization",9538,47.759,81.769
Evaluation of Acoustic Noise Level and Impulsiveness Inside Vehicles in Different Traffic Conditions,"Flor, D.| Pena, D.| Oliveira, H.L.| Pena, L.| de Sousa, V.A.| Martins, A.",6,57216582037| 57209855400| 57214550114| 57209848920| 6603844872| 57469265200,2022,2022-03-01,Sensors,22,5,-,1946,ISSN-14248220,130124,Journal,-,-,-,10,-,26,0.73,3,0,0.0,0.22,16,15,0,"Flor, D., Pena, D., Oliveira, H.L. and 3 more (...) (2022).Evaluation of Acoustic Noise Level and Impulsiveness Inside Vehicles in Different Traffic Conditions. Sensors,22(5) ",https://www.scopus.com/record/display.url?eid=2-s2.0-85125373889&origin=resultslist,10.3390/s22051946,Article,Gold|Green,2-s2.0-85125373889,35271093,Universidade Federal do Rio Grande do Norte,1,60023857| 60023857,Universidade Federal do Rio Grande do Norte| Universidade Federal do Rio Grande do Norte,57216582037,57469265200,57216582037,-,Brazil,1303| 1602| 1710| 2208| 3105| 3107,"Biochemistry| Analytical Chemistry| Information Systems| Electrical and Electronic Engineering| Instrumentation| Atomic and Molecular Physics, and Optics",SDG 11,"Noise Pollution,Acoustic Waves,Acoustic Variables Control",654,"Psychoacoustics,Sound Design,Sound Reproduction",11526,53.512,84.733
National holidays and social mobility behaviors: Alternatives for forecasting covid-19 deaths in brazil,"Aragão, D.P.| Dos Santos, D.H.| Mondini, A.| Gonçalves, L.M.G.",4,57218418830| 57190606005| 8545562400| 8843298100,2021,2021-11-01,International Journal of Environmental Research and Public Health,18,21,-,11595,ISSN-16617827,144989,Journal,-,20,-,34,-,34,0.18,3,0,0.0,2.37,46,46,0,"Aragão, D.P., Dos Santos, D.H., Mondini, A. and 1 more (...) (2021).National holidays and social mobility behaviors: Alternatives for forecasting covid-19 deaths in brazil. International Journal of Environmental Research and Public Health,18(21) ",https://www.scopus.com/record/display.url?eid=2-s2.0-85118345929&origin=resultslist,10.3390/ijerph182111595,Article,Gold|Green,2-s2.0-85118345929,34770108,Universidade Federal do Rio Grande do Norte| Universidade Estadual Paulista Júlio de Mesquita Filho,2,60023857| 60006028,"Universidade Federal do Rio Grande do Norte| """"Universidade Estadual Paulista """"Júlio de Mesquita Filho""""""""",57218418830,8843298100,8843298100,-,Brazil,2307| 2310| 2739,"Health, Toxicology and Mutagenesis| Pollution| Public Health, Environmental and Occupational Health",SDG 3| SDG 10,"COVID-19,SARS-CoV-2,Coronavirus",1500,"ARIMA,Mathematical Modeling,COVID-19",1102558,100,99.985
Sustainable Solutions for Sea Monitoring With Robotic Sailboats: N-Boat and F-Boat Twins,"Negreiros, A.P.F.| Correa, W.S.| de Araujo, A.P.D.| Santos, D.H.| Vilas-Boas, J.M.| Dias, D.H.N.| Clua, E.W.G.| Gonçalves, L.M.G.",8,56131277200| 57426608400| 57427425600| 57190606005| 57212746380| 57427154100| 24450364400| 8843298100,2022,2022-04-05,Frontiers in Robotics and AI,9,-,-,788212,ISSN-22969144,21100868821,Journal,-,-,-,30,-,39,0,0,0,0.0,0.27,16,15,0,"Negreiros, A.P.F., Correa, W.S., de Araujo, A.P.D. and 5 more (...) (2022).Sustainable Solutions for Sea Monitoring With Robotic Sailboats: N-Boat and F-Boat Twins. Frontiers in Robotics and AI,9",https://www.scopus.com/record/display.url?eid=2-s2.0-85128747185&origin=resultslist,10.3389/frobt.2022.788212,Article,Gold|Green,2-s2.0-85128747185,-,Universidade Federal Fluminense| Universidade Federal do Rio Grande do Norte,2,60023857| 60001865| 125187476| 60001865,Universidade Federal do Rio Grande do Norte| Universidade Federal Fluminense| Academic Directorate of Information Technology| Universidade Federal Fluminense,56131277200,8843298100,56131277200,-,Brazil,1702| 1706,Artificial Intelligence| Computer Science Applications,-,"Autonomous Underwater Vehicles,Underwater Acoustics,Remotely Operated Vehicles",1150,"Sailing Vessels,Ice Ridge,Autonomous",49325,40.87,69.75
4th order capacitively-coupled LC-based ΣΔ modulator,"Belfort, D.R.| Catunda, S.Y.C.| Aboushady, H.",3,24775112000| 6602674444| 6602629520,2017,2017-04-01,Microelectronics Journal,62,-,99-107,-,ISSN-00262692,9500153939,Journal,0.98,30,2.7,36,0.28,49,0.4,12,0,0.0,10.19,78,74,0,"Belfort, D.R., Catunda, S.Y.C., Aboushady, H. (2017).4th order capacitively-coupled LC-based ΣΔ modulator. Microelectronics Journal,6299-107",https://www.scopus.com/record/display.url?eid=2-s2.0-85014077400&origin=resultslist,10.1016/j.mejo.2017.02.012,Article,,2-s2.0-85014077400,-,Institut Polytechnique de Paris| CNRS| Sorbonne Université| Universidade Federal do Rio Grande do Norte| École polytechnique,5,60023857| 60112307| 60112307| 60001422| 60105982| 60105982| 60105982| 60105982,Universidade Federal do Rio Grande do Norte| Laboratoire d'Informatique de Paris 6| Laboratoire d'Informatique de Paris 6| Sorbonne Universite| Laboratoire Pour l'Utilisation des Lasers Intenses| Laboratoire Pour l'Utilisation des Lasers Intenses| Laboratoire Pour l'Utilisation des Lasers Intenses| Laboratoire Pour l'Utilisation des Lasers Intenses,24775112000,6602629520,24775112000,-,France| Brazil,2208| 2504| 2508| 3104| 3107,"Electrical and Electronic Engineering| Electronic, Optical and Magnetic Materials| Surfaces, Coatings and Films| Condensed Matter Physics| Atomic and Molecular Physics, and Optics",-,"CMOS Integrated Circuits,Networks (Circuits),Amplifiers (Electronic)",355,"Voltage Controlled Oscillators,Analog-To-Digital Converter,Delta Sigma Modulation",858,54.314,91.549
Bandwidth Enhancement of Microstrip Patch Antenna Using Metasurface,"Araújo, F.F.D.| Campos, A.L.P.D.S.| Lira, R.V.D.A.| Neto, A.G.| D'Assuncaõ, A.G.",5,57194409298| 16309023400| 57222577631| 6603647208| 57208902469,2021,2021-03-01,"Journal of Microwaves, Optoelectronics and Electromagnetic Applications",20,1,105-117,-,ISSN-21791074,20500195068,Journal,-,61,-,60,-,69,0.66,7,0,0.0,2.05,46,46,0,"Araújo, F.F.D., Campos, A.L.P.D.S., Lira, R.V.D.A. and 2 more (...) (2021).Bandwidth Enhancement of Microstrip Patch Antenna Using Metasurface. Journal of Microwaves, Optoelectronics and Electromagnetic Applications,20(1) 105-117",https://www.scopus.com/record/display.url?eid=2-s2.0-85103252495&origin=resultslist,10.1590/2179-10742021V20I1959,Article,Gold,2-s2.0-85103252495,-,Universidade Federal do Rio Grande do Norte,1,60023857| 113022837,Universidade Federal do Rio Grande do Norte| Federal Institute of Paraíba,57194409298,57208902469,-,-,Brazil,2208,Electrical and Electronic Engineering,-,"Antennas,Slot Antennas,Microwave Antennas",55,"Frequency Selective Surfaces,Radomes,Polarization",3944,93.043,96.63
A High-Selectivity Bandpass Filter Using Dual-Mode Coupling Resonator,"Duarte, J.G.| Oliveira, J.G.D.| da Silva Neto, V.P.| D'Assunção, A.G.",4,57219119640| 57213001300| 57423581000| 7004474343,2022,2022-01-01,"Journal of Microwaves, Optoelectronics and Electromagnetic Applications",21,1,131-140,-,ISSN-21791074,20500195068,Journal,-,-,-,60,-,69,0,0,0,0.0,0.25,16,15,0,"Duarte, J.G., Oliveira, J.G.D., da Silva Neto, V.P. and 1 more (...) (2022).A High-Selectivity Bandpass Filter Using Dual-Mode Coupling Resonator. Journal of Microwaves, Optoelectronics and Electromagnetic Applications,21(1) 131-140",https://www.scopus.com/record/display.url?eid=2-s2.0-85128660261&origin=resultslist,10.1590/2179-10742022v21i1254108,Article,Gold,2-s2.0-85128660261,-,Universidade Federal do Rio Grande do Norte,1,60023857| 60023857,Universidade Federal do Rio Grande do Norte| Universidade Federal do Rio Grande do Norte,57219119640,7004474343,-,-,Brazil,2208,Electrical and Electronic Engineering,-,"Antennas,Slot Antennas,Microwave Antennas",55,"Stepped Impedance Resonator,Bandpass Filters,Compact",635,93.043,93.199
Teaching computer programming with the help of digital games for 2nd and 3rd year students in the elementary school,"Marinheiro, F.| Silva, I.| Madeira, C.| Cordeiro, S.| Souza, D.| Costa, P.| Fernandes, G.",7,57191372707| 36537969500| 12238899000| 57191372304| 57191371274| 57214448564| 57195422311,2016,2016-01-01,CEUR Workshop Proceedings,1667,-,300-311,-,ISSN-16130073,21100218356,Conference Proceeding,0.32,75,0.6,83,-,-,2.04,27,0,0.0,3.62,78,72,0,"Marinheiro, F., Silva, I., Madeira, C. and 4 more (...) (2016).Teaching computer programming with the help of digital games for 2nd and 3rd year students in the elementary school. CEUR Workshop Proceedings,1667300-311",https://www.scopus.com/record/display.url?eid=2-s2.0-84989220404&origin=resultslist,-,Conference Paper,,2-s2.0-84989220404,-,Universidade Federal do Rio Grande do Norte,1,60023857| 60023857,Universidade Federal do Rio Grande do Norte| Universidade Federal do Rio Grande do Norte,57191372707,57195422311,-,-,Brazil,1700,General Computer Science,-,"Students,Education,Teaching",542,"Game-Based Learning,Educational Games,Serious Game",5528,76.856,99.024
Visual attractiveness in vehicle routing via bi-objective optimization,"Rocha, D.| Aloise, D.| Aloise, D.J.| Contardo, C.",4,57230334700| 12759644500| 6504045903| 26032523300,2022,2022-01-01,Computers and Operations Research,137,-,-,105507,ISSN-03050548,24355,Journal,-,-,-,5,-,5,1.34,18,0,0.0,0.25,16,15,0,"Rocha, D., Aloise, D., Aloise, D.J. and 1 more (...) (2022).Visual attractiveness in vehicle routing via bi-objective optimization. Computers and Operations Research,137",https://www.scopus.com/record/display.url?eid=2-s2.0-85113354651&origin=resultslist,10.1016/j.cor.2021.105507,Article,,2-s2.0-85113354651,-,"Interuniversity Research Centre on Enterprise Networks, Logistics and Transportation| University of Montreal| Universidade do Estado do Rio Grande do Norte| GERAD| Polytechnique Montreal| McGill University| Université du Québec à Montréal| Instituto Federal de Educação, Ciência e Tecnologia do Ceará, Fortaleza",8,60111728| 60007104| 60007104| 60007104| 60019141| 60019141| 60011385| 60113917| 60120292| 60007104| 60007104| 60007104,"Instituto Federal de Educação, Ciência e Tecnologia do Ceará, Fortaleza| Groupe d'études et de Recherche en Analyse des Décisions| Groupe d'études et de Recherche en Analyse des Décisions| Groupe d'études et de Recherche en Analyse des Décisions| Polytechnique Montréal| Polytechnique Montréal| Universidade do Estado do Rio Grande do Norte| Centre Interuniversitaire de Recherche sur les Réseaux d‘Entreprise, la Logistique et le Transport| École des Sciences de la Gestion| Groupe d'études et de Recherche en Analyse des Décisions| Groupe d'études et de Recherche en Analyse des Décisions| Groupe d'études et de Recherche en Analyse des Décisions",57230334700,26032523300,26032523300,-,Brazil| Canada,1700| 1803| 2611,General Computer Science| Management Science and Operations Research| Modeling and Simulation,-,"Vehicle Routing,Algorithms,Vehicles",931,"Time Windows,Pickup and Delivery,Dynamic Routing",252,70.769,99.599
Graphical interface to aid in development of travelling-wave-based line protection and fault location techniques,"Azevedo, S.S.B.| Costa, F.B.| Leal, M.S.R.| Franca, R.L.S.",4,57203003645| 22333585200| 57202999780| 57203003614,2018,2018-06-25,SBSE 2018 - 7th Brazilian Electrical Systems Symposium,-,-,1-6,-,-,21100868893,Conference Proceeding,-,-,-,-,-,-,1.09,14,0,0.0,2.78,77,75,0,"Azevedo, S.S.B., Costa, F.B., Leal, M.S.R. and 1 more (...) (2018).Graphical interface to aid in development of travelling-wave-based line protection and fault location techniques. SBSE 2018 - 7th Brazilian Electrical Systems Symposium,1-6",https://www.scopus.com/record/display.url?eid=2-s2.0-85050236730&origin=resultslist,10.1109/SBSE.2018.8395795,Conference Paper,,2-s2.0-85050236730,-,Universidade Federal do Rio Grande do Norte,1,60023857,Universidade Federal do Rio Grande do Norte,57203003645,57203003614,-,-,Brazil,2102| 2208| 2213| 3305,"Energy Engineering and Power Technology| Electrical and Electronic Engineering| Safety, Risk, Reliability and Quality| Geography, Planning and Development",-,"Electric Fault Location,Electric Lines,Electric Power Distribution",407,"Electric Fault Location,Fault Detection,Power Lines",1374,64.883,97.068
Project and analysis of quasi-periodic PBG for microstrip antenna,"Guimarães, Á.O.| Barreto, T.S.| Silva, J.P.| De Sena, F.C.B.| Pinheiro, J.P.P.| Lavor, O.P.",6,57040578700| 57219120571| 57212234960| 57192064454| 56573283600| 57190937433,2020,2020-06-01,"Journal of Microwaves, Optoelectronics and Electromagnetic Applications",19,2,152-164,-,ISSN-21791074,20500195068,Journal,0.61,61,1.9,60,0.214,69,0.46,7,0,0.0,5.91,68,68,0,"Guimarães, Á.O., Barreto, T.S., Silva, J.P. and 3 more (...) (2020).Project and analysis of quasi-periodic PBG for microstrip antenna. Journal of Microwaves, Optoelectronics and Electromagnetic Applications,19(2) 152-164",https://www.scopus.com/record/display.url?eid=2-s2.0-85091339465&origin=resultslist,10.1590/2179-10742020v19i2821,Article,Gold,2-s2.0-85091339465,-,Universidade Federal do Rio Grande do Norte,1,115362622| 60023857| 121156574,Federal Rural University of Semi-Arid| Universidade Federal do Rio Grande do Norte| Federal Institute of Education,57040578700,57190937433,-,-,Brazil,2208,Electrical and Electronic Engineering,-,"Antennas,Slot Antennas,Microwave Antennas",55,"Bandwidth,Directivity,Defected Ground Structures",84218,93.043,14.879
Design of Wavelet-Encoded Symbol Constellations for Cyclostationary Spectrum Sensing,"Valério De Souza, P.T.| Valério De Souza, V.S.| Felipe De Queiroz Silveira, L.",3,57214720757| 57214723274| 56363591700,2020,2020-01-01,Wireless Communications and Mobile Computing,2020,-,-,9863785,ISSN-15308669,17543,Journal,1.02,35,4.3,29,0.42,40,0.48,9,0,0.0,6.26,68,68,0,"Valério De Souza, P.T., Valério De Souza, V.S., Felipe De Queiroz Silveira, L. (2020).Design of Wavelet-Encoded Symbol Constellations for Cyclostationary Spectrum Sensing. Wireless Communications and Mobile Computing,2020",https://www.scopus.com/record/display.url?eid=2-s2.0-85078973990&origin=resultslist,10.1155/2020/9863785,Article,Gold|Green,2-s2.0-85078973990,-,Universidade Federal do Rio Grande do Norte,1,122241931| 60023857,UFERSA| Universidade Federal do Rio Grande do Norte,57214720757,56363591700,57214720757,-,Brazil,1705| 1710| 2208,Computer Networks and Communications| Information Systems| Electrical and Electronic Engineering,-,"Cognitive Radio,MIMO Systems,Orthogonal Frequency Division Multiplexing",3,"Wavelets,Spectral Efficiency,Maximal Ratio Combining",73825,97.793,44.857
"Multivariate data driven prediction of COVID-19 dynamics: Towards new results with temperature, humidity and air quality data","Aragão, D.P.| Oliveira, E.V.| Bezerra, A.A.| dos Santos, D.H.| da Silva Junior, A.G.| Pereira, I.G.| Piscitelli, P.| Miani, A.| Distante, C.| Cuno, J.S.| Conci, A.| Gonçalves, L.M.G.",12,57218418830| 57337603300| 57337603400| 57190606005| 57190608444| 57195577525| 36944994400| 7005511583| 55884135100| 57212504068| 6701460323| 8843298100,2022,2022-03-01,Environmental Research,204,-,-,112348,ISSN-00139351,21524,Journal,-,-,-,10,-,11,5.04,28,0,0.0,0.32,16,15,0,"Aragão, D.P., Oliveira, E.V., Bezerra, A.A. and 9 more (...) (2022).Multivariate data driven prediction of COVID-19 dynamics: Towards new results with temperature, humidity and air quality data. Environmental Research,204",https://www.scopus.com/record/display.url?eid=2-s2.0-85119042067&origin=resultslist,10.1016/j.envres.2021.112348,Article,Bronze|Green,2-s2.0-85119042067,34767822,Universidade Federal Fluminense| National Research Council of Italy| University of Milan| Universidade Federal do Rio Grande do Norte,4,60023857| 127212181| 126208518| 60030318| 60108660| 60001865,"Universidade Federal do Rio Grande do Norte| R. Raimundo Firmino de Oliveira| (SIMA)| Università degli Studi di Milano| National Reseach Council of Italy (CNR), Institute of Applied Sciences and Intelligent Systems “Edua| Universidade Federal Fluminense",57218418830,8843298100,8843298100,-,Italy| Brazil,1303| 2300,Biochemistry| General Environmental Science,SDG 3| SDG 11,"COVID-19,SARS-CoV-2,Coronavirus",1500,"Environmental Pollution,Medical Waste,COVID-19",1114223,100,99.927
Message from the WAMCA 2020 General Chair: SBAC-PAD 2020,"Tadonki, C.| Bentes, C.| Mencagli, G.| Drummond, L.| Castro, M.C.| De Souza, S.X.| Navaux, P.",7,22433917100| 23487649600| 35759195500| 7006818287| 7102295178| 7801645972| 6603651062,2020,2020-09-01,Proceedings - Symposium on Computer Architecture and High Performance Computing,2020-,-,-,9235034,ISSN-15506533,145120,Conference Proceeding,-,-,-,-,-,-,0.19,1,0,0.0,0.39,68,68,0,"Tadonki, C., Bentes, C., Mencagli, G. and 4 more (...) (2020).Message from the WAMCA 2020 General Chair: SBAC-PAD 2020. Proceedings - Symposium on Computer Architecture and High Performance Computing,2020-",https://www.scopus.com/record/display.url?eid=2-s2.0-85095879368&origin=resultslist,10.1109/SBAC-PAD49847.2020.00053,Editorial,Bronze,2-s2.0-85095879368,-,Universidade Federal do Rio Grande do Sul| Université PSL| Universidade Federal Fluminense| École des mines Paris| Universidade do Estado do Rio de Janeiro| Universidade Federal do Rio Grande do Norte| University of Pisa,7,60030506| 60030506| 60108665| 60005499| 60028868| 60001865| 60023857| 60006726,Mines ParisTech| Mines ParisTech| Université PSL| Universidade do Estado do Rio de Janeiro| Università di Pisa| Universidade Federal Fluminense| Universidade Federal do Rio Grande do Norte| Universidade Federal do Rio Grande do Sul,22433917100,6603651062,-,-,Italy| France| Brazil,1708| 1712,Hardware and Architecture| Software,-,-,-,-,-,-,-
MACD e-ICIC: a dynamic LTE interference coordination method based on trend and trading know-how,"de Melo, Y.V.L.| de Sousa, V.A.| Maciel, T.F.",3,56444447900| 6603844872| 6603222705,2021,2021-03-01,Telecommunication Systems,76,3,391-402,-,ISSN-10184864,21916,Journal,-,43,-,29,-,46,0.66,9,0,0.0,2.05,46,46,0,"de Melo, Y.V.L., de Sousa, V.A., Maciel, T.F. (2021).MACD e-ICIC: a dynamic LTE interference coordination method based on trend and trading know-how. Telecommunication Systems,76(3) 391-402",https://www.scopus.com/record/display.url?eid=2-s2.0-85092347733&origin=resultslist,10.1007/s11235-020-00725-2,Article,,2-s2.0-85092347733,-,Universidade Federal do Ceará| Universidade Federal do Rio Grande do Norte,2,60020457| 60023857,Universidade Federal do Ceará| Universidade Federal do Rio Grande do Norte,56444447900,6603222705,6603844872,-,Brazil,2208,Electrical and Electronic Engineering,-,"Cognitive Radio,MIMO Systems,Orthogonal Frequency Division Multiplexing",3,"Heterogeneous Networks,LTE-advanced,Interference",31467,97.793,69.522
Assessment of power frequency estimation methods in distributed generation in islanding condition,"Sanca, H.S.| Campos, J.T.L.S.| Souza Júnior, F.C.| Costa, F.B.| de Souza, B.A.",5,57192149097| 56682493500| 57188873004| 22333585200| 56249553100,2018,2018-01-01,Przeglad Elektrotechniczny,94,5,3-8,-,ISSN-00332097,18700,Journal,0.43,70,0.7,80,0.204,66,0.79,15,0,0.0,11.26,77,75,0,"Sanca, H.S., Campos, J.T.L.S., Souza Júnior, F.C. and 2 more (...) (2018).Assessment of power frequency estimation methods in distributed generation in islanding condition. Przeglad Elektrotechniczny,94(5) 3-8",https://www.scopus.com/record/display.url?eid=2-s2.0-85046781387&origin=resultslist,10.15199/48.2018.05.01,Article,,2-s2.0-85046781387,-,Universidade Federal de Campina Grande| Universidade Potiguar| Universidade Federal do Recôncavo da Bahia| Universidade Federal do Rio Grande do Norte,4,60004778| 60027877| 120666750| 60023857| 60003709,Universidade Federal do Reconcavo da Bahia| Universidade Potiguar| Escola Multicampi de Ciências Médicas do Rio Grande do Norte| Universidade Federal do Rio Grande do Norte| Universidade Federal de Campina Grande,57192149097,56249553100,-,-,Brazil,2208,Electrical and Electronic Engineering,SDG 7,"Electric Potential,Electric Inverters,DC-DC Converters",13,"Phasor Measurement Unit,Frequency Estimation,Power System",7260,98.462,93.597
Modeling and Controllers Design for an Electromagnetic Frequency Regulator Applied to Wind Systems,"Do Nascimento, T.F.| Nunes, E.A.F.| Salazar, A.O.",3,57476970500| 57203121220| 7102422753,2021,2021-01-01,"2021 Brazilian Power Electronics Conference, COBEP 2021",-,-,-,-,-,21101079102,Conference Proceeding,-,-,-,-,-,-,0.23,1,0,0.0,0.2,46,46,0,"Do Nascimento, T.F., Nunes, E.A.F., Salazar, A.O. (2021).Modeling and Controllers Design for an Electromagnetic Frequency Regulator Applied to Wind Systems. 2021 Brazilian Power Electronics Conference, COBEP 2021,",https://www.scopus.com/record/display.url?eid=2-s2.0-85125716976&origin=resultslist,10.1109/COBEP53665.2021.9684101,Conference Paper,,2-s2.0-85125716976,-,Universidade Federal do Rio Grande do Norte,1,60023857| 127805150,Universidade Federal do Rio Grande do Norte| Federal Institute of Bahia,57476970500,7102422753,-,-,Brazil,2102| 2105| 2208| 2606,"Energy Engineering and Power Technology| Renewable Energy, Sustainability and the Environment| Electrical and Electronic Engineering| Control and Optimization",SDG 7| SDG 14,"Wind Turbines,Wind Power,Asynchronous Generators",423,"Hydraulic Turbines,Hydrostatics,Speed Control",43068,85.084,78.543
Robot programming at different abstraction levels,"Fernandes, C.| Barros, R.| Albuquerque, E.| Sa, S.| Goncalves, L.",5,55953379500| 26667560800| 57205730944| 57193607830| 8843298100,2019,2019-10-01,"Proceedings - 2019 Latin American Robotics Symposium, 2019 Brazilian Symposium on Robotics and 2019 Workshop on Robotics in Education, LARS/SBR/WRE 2019",-,-,459-464,9018568,-,21100973634,Conference Proceeding,-,-,-,-,-,-,0.68,9,0,0.0,2.73,74,74,0,"Fernandes, C., Barros, R., Albuquerque, E. and 2 more (...) (2019).Robot programming at different abstraction levels. Proceedings - 2019 Latin American Robotics Symposium, 2019 Brazilian Symposium on Robotics and 2019 Workshop on Robotics in Education, LARS/SBR/WRE 2019,459-464",https://www.scopus.com/record/display.url?eid=2-s2.0-85082170827&origin=resultslist,10.1109/LARS-SBR-WRE48964.2019.00087,Conference Paper,,2-s2.0-85082170827,-,Universidade Federal do Rio Grande do Norte,1,60023857| 108271941,Universidade Federal do Rio Grande do Norte| Instituto Federal do Rio Grande do Norte,55953379500,8843298100,-,-,Brazil,1702| 1706| 2606| 2611| 3304,Artificial Intelligence| Computer Science Applications| Control and Optimization| Modeling and Simulation| Education,-,"Students,Teaching,Education; Computer Science",559,"Education,Lego,Robotics",8173,65.217,96.736
